category,url_or_file,issue,evidence,impact,recommended_fix,priority,effort
運営者情報,templates/about.html,運営者名・連絡先・所在地が明記されていない,Aboutページに運営者情報セクションがない,AdSense審査で「運営者情報が不明確」として不承認になる可能性が高い,Aboutページに「運営者情報」セクションを追加し、運営者名・連絡先・所在地を明記,P0,1-2時間
コンテンツ品質,templates/tools/*.html,コンテンツの目的が不明確,一部ツールページで「何ができるか」「誰のためのものか」が不明確,「薄いコンテンツ」として不承認になる可能性,各ツールページに「このツールでできること」「こんな人におすすめ」セクションを追加,P0,3-4時間
コンテンツ品質,templates/*.html,AI生成コンテンツ表記がない,AI生成コンテンツの表記がない,AdSenseポリシー違反の可能性,必要に応じてAI生成コンテンツの表記を追加,P0,30分
コンテンツ品質,templates/tools/*.html,薄いコンテンツの可能性,一部ツールページで利用シーン・差別化が不足,「価値の低いコンテンツ」として不承認になる可能性,各ツールページに利用シーン・差別化・FAQを追加,P1,5-6時間
ナビゲーション,templates/*.html,ナビゲーションの統一,一部ページでフッターリンクが不足している可能性,ユーザー体験の低下、AdSense審査での減点,全ページでフッターリンクの一貫性を確保,P1,1-2時間
コンテンツ品質,templates/*.html,コンテンツの重複,一部ページでtitle/descriptionが重複している可能性,SEOの低下、AdSense審査での減点,title/descriptionの重複を排除,P1,2-3時間
コンテンツ品質,templates/blog/*.html,更新日が不明確,ブログ記事に更新日が不明確,コンテンツの鮮度が不明確,ブログ記事に更新日を追加,P2,2-3時間
ナビゲーション,templates/*.html,内部リンクの強化,関連ページ間のリンクが不足,SEOの低下、ユーザー体験の低下,関連ページ間のリンクを追加,P2,3-4時間
